url,住所,書店名称,郵便番号,都道府県,電話番号
http://honto.jp/store/detail_1577305_14HB310.html,福岡県福岡市博多区博多駅中央街1-1 博多駅ﾋﾞﾙｱﾐｭﾌﾟﾗｻﾞ8F,丸善博多店,〒812-0012,福岡県,092-413-5401
http://www.kinokuniya.co.jp/,福岡県福岡市博多区博多駅中央街2-1 福岡交通ｾﾝﾀｰﾋﾞﾙ6F,紀伊國屋書店福岡本店,〒812-0012,福岡県,092-434-3100
http://www.kinbun.co.jp/profile/profile.html,福岡県福岡市城南区七隈8-19-1 福岡大学構内,福岡金文堂福岡大学店,〒814-0180,福岡県,092-871-1611
,福岡県福岡市西区元岡744 九州大学内ｳｴｽﾄｿﾞｰﾝ　ﾋﾞｯｸﾞどら,九大生協ビッグどら店,〒819-0385,福岡県,092-834-2310
,福岡県福岡市西区元岡744,九州大学生協伊都皎皎舎店,〒819-0385,福岡県,092-805-7700
,福岡県福岡市西区元岡744 九大生協ｳｴｽﾄ5号館,九州大学生協農学部店,〒819-0395,福岡県,
,福岡県久留米市上津町2228-66,久留米工業大学購買部菊竹金文堂,〒830-0052,福岡県,0942-22-2123
http://www.kinokuniya.co.jp/,福岡県久留米市新合川1-2-1 ゆめﾀｳﾝ久留米2F,紀伊國屋書店久留米店,〒839-0865,福岡県,0942-45-7170
http://www.kinokuniya.co.jp/,佐賀県佐賀市兵庫町兵庫北5丁目14番1号 ゆめﾀｳﾝ佐賀2F,紀伊國屋書店佐賀店,〒849-0919,佐賀県,0952-36-8171
http://www.kinokuniya.co.jp/,長崎県長崎市元船町10-1 夢彩都4F,紀伊國屋書店長崎店,〒850-0035,長崎県,095-811-4919
http://www.metrobooks.co.jp/,長崎県長崎市尾上町1-1 ｱﾐｭﾌﾟﾗｻﾞ長崎3F,メトロ書店本店,〒850-0058,長崎県,095-821-5464
http://www.sannenzaka.jp/,熊本県熊本市中央区安政町1-2 ｶﾘｰﾉ下通2F,蔦屋書店熊本三年坂,〒860-0801,熊本県,096-212-9101
http://www.kinokuniya.co.jp/,熊本県菊池郡菊陽町光の森7-33-1 ゆめﾀｳﾝ光の森本館2F,紀伊國屋書店熊本光の森店,〒869-1108,熊本県,096-233-1700
http://honto.jp/store/detail_1570014_14HB320.html,大分県大分市中央町2-3-4 1階~5階,ジュンク堂書店大分店,〒870-0035,大分県,097-536-8181
http://www.kinokuniya.co.jp/,大分県大分市一木1727,紀伊國屋書店日本文理大学ブックセンター,〒870-0316,大分県,097-593-0955
http://www.miraiyashoten.co.jp/,宮崎県宮崎市新別府町江口862-1 ｲｵﾝﾓｰﾙ宮崎 新館2F,未来屋書店宮崎店,〒880-0834,宮崎県,0985-77-7507
http://kk-misumi.jp/,鹿児島県鹿児島市宇宿2-3-5 ｵﾌﾟｼｱﾐｽﾐ1F,ブックスミスミオプシア,〒890-0073,鹿児島県,099-813-7012
http://honto.jp/store/detail_1570058_14HB320.html,鹿児島県鹿児島市呉服町6-5 ﾏﾙﾔｶﾞｰﾃﾞﾝｽﾞ5F･6F,ジュンク堂書店鹿児島店,〒892-0826,鹿児島県,099-216-8838
http://honto.jp/store/detail_1570050_14HB320.html,沖縄県那覇市牧志1-19-29 Dnaha内,ジュンク堂書店那覇店,〒900-0013,沖縄県,098-860-7175
http://www.todabooks.co.jp/,沖縄県豊見城市豊崎1-420,戸田書店豊見城店,〒901-0225,沖縄県,098-852-2511
